{"$schema":"https://json-schema.org/draft/2020-12/schema","title":"Project V7 Patch Module","type":"object","required":["id","name","version","kind","description","targets","operations"],"properties":{"id":{"type":"string"},"name":{"type":"string"},"version":{"type":"string"},"kind":{"enum":["general","game"]},"description":{"type":"string"},"targets":{"type":"object"},"dependencies":{"type":"array","items":{"type":"string"}},"operations":{"type":"array","items":{"type":"object","required":["type"]}}}}